average_flavor_rating,brand_name,link,number_of_flavors,number_of_reviews,overall_rating,price,price_per_serving,product_category,product_description,product_name,top_flavor_rated,verified_buyer_number,verified_buyer_rating
9.1,EVLUTION NUTRITION,https://sa.bodybuilding.com/store/evlution-nutrition/bcaa-energy.html?skuId=EVL4230288,29,2575,9.4,19.99,0.67,BCAAs,BCAA Powder with Natural Energizers Sourced from Green Coffee and Green Tea To Support Focus and Recovery*,BCAA Energy,Pink Starblast,1594,9
8.4,Optimum Nutrition,https://sa.bodybuilding.com/store/opt/whey.html?skuId=OPT302,43,9926,9.3,57.99,0.79,Build Muscle Products,24g of Whey Protein with Amino Acids for Muscle Recovery and Growth*,Gold Standard 100% Whey,Unflavored,3932,9
8.3,JYM Supplement Science,https://sa.bodybuilding.com/store/jym/pre-jym.html?skuId=JYM4910066,9,3947,9.1,48.99,1.63,Improve Workout Products,Pre-Workout Powder Powerhouse Packed with 13-Hand Picked Ingredients to Support Improved Workouts*,Pre JYM,Raspberry Lemonade,3471,9
,Optimum Nutrition,https://sa.bodybuilding.com/store/opt/essential-amino-energy.html?skuId=OPT1900064,,2466,9.1,18.99,0.63,Amino Acids,Amino Acid Powder with Caffeine from Natural Sources!,Essential AmiN.O. Energy,,,
8.7,JYM Supplement Science,https://sa.bodybuilding.com/store/jym/pro-jym.html?skuId=JYM5570006,14,2506,9.2,56.98,1.1,Whey Protein Isolate,"24g of Pure, Quality Protein in Every Scoop with No Added Amino Acids or Filler Nutrients",Pro JYM,S'mores,2275,9
,MuscleTech,https://sa.bodybuilding.com/store/muscletech/essential-series-platinum-100-creatine.html?skuId=MT2320202,,895,9.5,7.55,0.09,Creatine Monohydrate,5g of Micronized Creatine to Support Lean Muscle and Increase Strength*,Platinum 100% Creatine,,,
,JYM Supplement Science,https://sa.bodybuilding.com/store/jym/post-jym.html?skuId=JYM4910043,,1356,9.5,30.39,1.01,Build Muscle Products,"Powerful Cocktail Designed to Help Boost Repair, Maximize Recovery, and Build Muscle*",Post JYM Active Matrix,,,
9.1,EVLUTION NUTRITION,https://sa.bodybuilding.com/store/evlution-nutrition/engn-shred.html?skuId=EVL4860177,6,1275,9.3,34.99,1.17,Betaine Anhydrous,Advanced Pre-Workout + Weight Management,ENGN Shred,Pink Lemonade,658,9
9.3,EVLUTION NUTRITION,https://sa.bodybuilding.com/store/evlution-nutrition/engn.html?skuId=EVL4040237,12,3414,9.1,29.99,1,Improve Workout Products,"Intense Pre-Workout Powder for Increased Energy, Power, & Focus*",ENGN,Pineapple,1924,9
,BSN,https://sa.bodybuilding.com/store/bsn/synth.html?skuId=BSN158,,3920,9.2,44.99,0.94,Whey Protein,"22g of an Ultra-Premium Blended Protein Formula for Use Anytime, Day or Night",Syntha-6,,,
8.9,EVLUTION NUTRITION,https://sa.bodybuilding.com/store/evlution-nutrition/bcaa-5000.html?skuId=EVL5290029,10,1636,9.3,17.99,0.6,Amino Acids,"BCAA Powder with 5g BCAAs, Zero Sugar and Zero Calories to Support Recovery and Endurance*",BCAA 5000,White Grape,964,9
9.3,RSP Nutrition,https://sa.bodybuilding.com/store/rsp-nutrition/aminolean.html?skuId=RSP4070217,9,2633,9.6,19.97,0.67,Amino Acids,Essential Amino Acids Formulated with Caffeine from Natural Sources to Support Building Lean Muscle*,AminoLean Energy Formula,Blue Raspberry,1367,9
9.2,BSN,https://sa.bodybuilding.com/store/bsn/syntha-6-protein-crisp.html?skuId=BSN5170046,10,251,9.6,19.99,1.67,Whey Protein,Crispy Protein Bar Provides 20 Grams Of Protein With 4 Grams Of Sugar Per Bar,Protein Crisp,Mint Mint Chocolate Chocolate Chip,156,9
8.8,Kaged Muscle,https://sa.bodybuilding.com/store/kaged-muscle/pre-kaged.html?skuId=KAG5310044,4,1819,9.3,37.99,1.9,Improve Workout Products,Turn Up Your Workout Intensity and Increase Performance with a Revolutionary Workout Primer*,PRE-KAGED,Berry Blast,1202,9
,Dymatize,https://sa.bodybuilding.com/store/dymatize/iso-100.html?skuId=DYM4750017,,2332,9.4,74.99,0.99,Build Muscle Products,Hydrolyzed 100% Whey Protein Isolate,ISO100,,,
8.4,Optimum Nutrition,https://sa.bodybuilding.com/store/opt/whey.html?skuId=OPT194,43,9926,9.3,29.98,1.03,Build Muscle Products,24g of Whey Protein with Amino Acids for Muscle Recovery and Growth*,Gold Standard 100% Whey,Unflavored,3932,9
,Bodybuilding.com Signature,https://sa.bodybuilding.com/store/bodybuilding-com-signature/signature-protein-crunch-bars.html?skuId=BBCOM5560028,,178,9.7,24.99,2.08,,Contains 20g of Whey Protein in Each Bar to Support Workout Recovery & Lean Muscle Growth*,Signature Protein Crunch Bars,,,
,Bodybuilding.com Signature,https://sa.bodybuilding.com/store/bodybuilding-com/signature-creatine-monohydrate.html?skuId=BBCOM5100081,,44,9.5,9.99,0.12,Creatine Monohydrate,Performance and Muscle Building*,Signature Creatine Monohydrate,,,
,EVLUTION NUTRITION,https://sa.bodybuilding.com/store/evlution-nutrition/vitamode.html?skuId=EVL4410051,,719,9.5,16.99,0.57,Multivitamins,High Performance Multi-Vitamin for Overall Health*,VitaMode,,458,9
,Scivation,https://sa.bodybuilding.com/store/sv/xtend.html?skuId=SV2441534,,2800,9.2,27.99,0.93,Amino Acids,"Intra-Workout Powder with 7g of BCAAs to Build Muscle, Burn Fat, and Aid Recovery During Workouts*",Xtend,,,
,Optimum Nutrition,https://sa.bodybuilding.com/store/opt/men.html?skuId=OPT2380278,,1644,9.2,14.6,0.49,Men's Health Products,Active Ingredients and Essential Daily Nutrients in One Convenient Tablet*,Opti-Men,,,
8.6,GAT,https://sa.bodybuilding.com/store/gat/nitraflex.html?skuId=GAT3660245,10,549,9.1,29.99,1,Improve Workout Products,"Pre-Training Formula for Bigger, Better Workouts*",NITRAFLEX,Pina Colada,297,9
,Bodybuilding.com Signature,https://sa.bodybuilding.com/store/bodybuilding-com/signature-100-percent-whey-protein.html?skuId=BBCOM5320019,,543,8.8,49.99,0.75,,25g of Muscle-Building Whey Protein*,Signature 100% Whey Protein,,,
,Animal,https://sa.bodybuilding.com/store/univ/animalpak.html?skuId=UNIV020,,1765,9.3,28.95,1.32,Health & Wellness Products,Supports Rigorous Training for All Competitive Strength and Power Athletes*,Animal Pak,,,
8.5,EVLUTION NUTRITION,https://sa.bodybuilding.com/store/evlution-nutrition/evltest.html?skuId=EVL2760018,1,1370,9,34.99,1.17,D-Aspartic Acid,Science Based Natural Testosterone Support Complex*!,EVL TEST,Blue Raz,724,8
9.2,EVLUTION NUTRITION,https://sa.bodybuilding.com/store/evlution-nutrition/bcaa-lean-energy.html?skuId=EVL4620067,6,484,9.6,24.99,0.83,BCAAs,BCAAs + Energy + Weight Management*,BCAA Lean Energy,Cherry Limeade,244,9
,JYM Supplement Science,https://sa.bodybuilding.com/store/jym/vita-jym.html?skuId=JYM5000189,,460,9.5,26,0.87,Multivitamins,Science Based Formula Provides Micronutrients Athletes Need to Support Growth and Overall Well-Being*,Vita JYM,,427,9
8.7,JYM Supplement Science,https://sa.bodybuilding.com/store/jym/pro-jym.html?skuId=JYM5100050,14,2506,9.2,34.99,1.35,Whey Protein Isolate,"24g of Pure, Quality Protein in Every Scoop with No Added Amino Acids or Filler Nutrients",Pro JYM,S'mores,2275,9
,Scivation,https://sa.bodybuilding.com/store/sv/xtend.html?skuId=SV2441532,,2800,9.2,64.99,0.72,Amino Acids,"Intra-Workout Powder with 7g of BCAAs to Build Muscle, Burn Fat, and Aid Recovery During Workouts*",Xtend,,,
,BSN,https://sa.bodybuilding.com/store/bsn/synth.html?skuId=BSN068,,3920,9.2,29.58,1.06,Whey Protein,"22g of an Ultra-Premium Blended Protein Formula for Use Anytime, Day or Night",Syntha-6,,,
,BSN,https://sa.bodybuilding.com/store/bsn/synth.html?skuId=BSN5430003,,3920,9.2,29.58,1.06,Whey Protein,"22g of an Ultra-Premium Blended Protein Formula for Use Anytime, Day or Night",Syntha-6,,,
8.4,Optimum Nutrition,https://sa.bodybuilding.com/store/opt/whey.html?skuId=OPT2780023,43,9926,9.3,47.99,0.96,Build Muscle Products,24g of Whey Protein with Amino Acids for Muscle Recovery and Growth*,Gold Standard 100% Whey,Unflavored,3932,9
8.4,Optimum Nutrition,https://sa.bodybuilding.com/store/opt/whey.html?skuId=OPT3470086,43,9926,9.3,111.99,0.77,Build Muscle Products,24g of Whey Protein with Amino Acids for Muscle Recovery and Growth*,Gold Standard 100% Whey,Unflavored,3932,9
,Bodybuilding.com Signature,https://sa.bodybuilding.com/store/bodybuilding-com/signature-multivitamin.html?skuId=BBCOM5100070,,35,9.4,14.99,0.17,Multivitamins,Formulated for the Needs of Athletes*,Signature Multivitamin,,,
,Optimum Nutrition,https://sa.bodybuilding.com/store/opt/essential-amino-energy.html?skuId=OPT4380078,,2466,9.1,30.39,0.47,Amino Acids,Amino Acid Powder with Caffeine from Natural Sources!,Essential AmiN.O. Energy,,,
,JYM Supplement Science,https://sa.bodybuilding.com/store/jym/shred-jym.html?skuId=JYM5000186,,683,8.6,25.99,0.65,Acetyl L-Carnitine,Three Stage Fat-Loss Support Capsule*,Shred JYM,,610,8
,MuscleTech,https://sa.bodybuilding.com/store/muscletech/muscletech-performance-series-nitro-tech-100percent-whey-gold.html?skuId=MT4450104,,1882,9,56.99,0.74,Whey Protein,Each Scoop Serves Up 24G Of Ultra-Premium Micro-Filtered Protein,NITRO-TECH 100% Whey Gold,,,
8.3,JYM Supplement Science,https://sa.bodybuilding.com/store/jym/pre-jym.html?skuId=JYM5440012,9,3947,9.1,37.99,1.9,Improve Workout Products,Pre-Workout Powder Powerhouse Packed with 13-Hand Picked Ingredients to Support Improved Workouts*,Pre JYM,Raspberry Lemonade,3471,9
8.5,Bodybuilding.com Signature,https://sa.bodybuilding.com/store/bodybuilding-com/signature-bcaa.html?skuId=BBCOM5370005,6,129,8.7,17.99,0.6,Build Muscle Products,Fuel and Recovery Powerhouse*,Signature BCAA,Tropical Pineapple,94,8
9.8,RSP Nutrition,https://sa.bodybuilding.com/store/rsp-nutrition/creatine-monohydrate.html?skuId=RSP2400036,1,809,9.7,14.97,0.15,Creatine Monohydrate,5G Of Pharmaceutical Grade Micronized Creatine To Support Growth*,Creatine Monohydrate,Unflavored,537,9
,Bodybuilding.com Signature,https://sa.bodybuilding.com/store/bodybuilding-com/signature-pre-workout.html?skuId=BBCOM5100078,,181,8,27.99,0.93,,Energizes and Delays the Onset of Muscle Fatigue*,Signature Pre Workout,,,
,Dymatize,https://sa.bodybuilding.com/store/dymatize/iso-100.html?skuId=DYM1930102,,2332,9.4,49.99,1.11,Build Muscle Products,Hydrolyzed 100% Whey Protein Isolate,ISO100,,,
,RSP Nutrition,https://sa.bodybuilding.com/store/rsp-nutrition/prime-t.html?skuId=RSP4760030,,921,9.3,34.97,1.17,,Scientifically Formulated Testosterone Support*,Prime-T,,468,9
,JYM Supplement Science,https://sa.bodybuilding.com/store/jym/alpha-jym.html?skuId=JYM5000190,,352,8.4,34.87,0.58,Fenugreek,Helps Support a Healthy Testosterone and Estrogen Balance*,Alpha JYM,,308,8
9.2,EVLUTION NUTRITION,https://sa.bodybuilding.com/store/evlution-nutrition/pumpmode.html?skuId=EVL5290028,7,767,9,19.99,0.67,,Non-Stimulant Pump Accelerator,PumpMode,Pink Lemonade,382,8
,Bodybuilding.com Signature,https://sa.bodybuilding.com/store/bodybuilding-com/signature-100-percent-whey-protein.html?skuId=BBCOM5100066,,543,8.8,26.99,1,,25g of Muscle-Building Whey Protein*,Signature 100% Whey Protein,,,
,JYM Supplement Science,https://sa.bodybuilding.com/store/jym/zma-jym.html?skuId=JYM5000187,,317,9.1,18.38,0.61,Build Muscle Products,Zinc And Magnesium Capsule To Help Maintain Optimal Hormone Levels*,ZMA JYM,,284,9
9.1,EVLUTION NUTRITION,https://sa.bodybuilding.com/store/evlution-nutrition/bcaa-energy.html?skuId=EVL5390013,29,2575,9.4,39.99,0.62,BCAAs,BCAA Powder with Natural Energizers Sourced from Green Coffee and Green Tea To Support Focus and Recovery*,BCAA Energy,Pink Starblast,1594,9
8.8,Cellucor,https://sa.bodybuilding.com/store/cellucor/c4.html?skuId=CELLU4620196,23,4290,8.7,29.99,1,Beta-Alanine,An Advanced Pre-Workout Formulated for Anyone Seeking Increased Energy and Focus*,C4 Original,Juicy Candy Burst,1491,8
,Kaged Muscle,https://sa.bodybuilding.com/store/kaged-muscle/in-kaged.html?skuId=KAG3460042,,498,9.6,21.19,1.06,BCAAs,Intra-Workout Fuel to Help Improve Endurance and Enhance Your Toughest Workouts*,In-Kaged,,,
9,EVLUTION NUTRITION,https://sa.bodybuilding.com/store/evlution-nutrition/stacked-protein.html?skuId=EVL4090116,12,1445,9.2,29.99,1.25,Whey Protein,"25 Gram Protein Complex With Milkshake Taste, With 5g BCAAs and 5g Glutamine To Fuel Your Results!*",Stacked Protein,Gingerbread,827,9
8.8,Optimum Nutrition,https://sa.bodybuilding.com/store/opt/platinum_hydrowhey.html?skuId=OPT380,10,1179,9.4,52.8,1.39,Hydrolyzed Whey Protein,Hydrolyzed Whey Protein Powder to Build Muscle*,Platinum Hydrowhey,Turbo Chocolate,432,9
9,Optimum Nutrition,https://sa.bodybuilding.com/store/opt/gainer.html?skuId=OPT219,5,729,9.3,69.69,2.49,Whey Protein,Whey Protein Powder for Serious Muscle Gain*,Pro Gainer,Double Chocolate,411,9
,BSN,https://sa.bodybuilding.com/store/bsn/aminox.html?skuId=BSN1960036,,1839,9.2,15.99,0.53,Amino Acids,BCAA Recovery Powder Designed to Offset Muscle Breakdown and Increase Muscular Endurance*,AMINOx,,,
9.2,MuscleTech,https://sa.bodybuilding.com/store/muscletech/pro-series-neurocore-pre-workout.html?skuId=MT5040060,2,650,9.4,20.99,0.64,Beta-Alanine,Ultra-Intense Energy And Focus*,NeuroCore Pre-Workout,Cherry Limeade,64,9
,JYM Supplement Science,https://sa.bodybuilding.com/store/jym/post-jym-carb.html?skuId=JYM5080030,,317,9.4,13.59,0.45,Carbohydrates,Dextrose Powder to Replenish Muscle Glycogen Stores*,Post JYM Carb,,,
8,Optimum Nutrition,https://sa.bodybuilding.com/store/opt/sm.html?skuId=OPT3240104,7,1118,8.5,47.98,3,Whey Protein,Protein Powder Weight Gainer*,Serious Mass,Chocolate Peanut Butter,430,8
9.3,EVLUTION NUTRITION,https://sa.bodybuilding.com/store/evlution-nutrition/trans4orm.html?skuId=EVL4040242,2,1857,9.1,29.99,0.5,Weight Loss Products,"Complete Multistage Thermogenic for Fat Loss, with Natural Energy Sources and Focus.*",TRANS4ORM,Blue Raz,845,9
8.2,Quest Nutrition,https://sa.bodybuilding.com/store/quest/quest-bars.html?skuId=QUEST3410052,25,1211,9.3,29.99,2.5,Whey Protein Isolate,"Clean, Gluten Free Bar with High Quality Protein and No Added Sugar*",Quest Bars,Maple Waffle,648,9
,MusclePharm,https://sa.bodybuilding.com/store/musclepharm/combat-crunch-bars.html?skuId=MPHARM2600002,,1334,8.8,17.49,1.46,Whey Protein Isolate,Gluten Free Multi-Layered Baked Bar with 20G of Protein,Combat Crunch Bars,,,
,Kaged Muscle,https://sa.bodybuilding.com/store/kaged-muscle/hydra-charge.html?skuId=KAG2960037,,234,9.7,23.93,0.4,Electrolytes,Next Level Of Hydration In Sports Nutrition,Hydra-Charge,,,
7.9,Optimum Nutrition,https://sa.bodybuilding.com/store/opt/cas.html?skuId=OPT283,13,2601,8.8,53.94,1.02,Micellar Casein Protein,Nighttime Use Protein Powder for Building Muscle*,Gold Standard 100% Casein,Chocolate supremo,925,8
8.9,EVLUTION NUTRITION,https://sa.bodybuilding.com/store/evlution-nutrition/bcaa-5000.html?skuId=EVL3460023,10,1636,9.3,19.99,0.33,Amino Acids,"BCAA Powder with 5g BCAAs, Zero Sugar and Zero Calories to Support Recovery and Endurance*",BCAA 5000,White Grape,964,9
,Optimum Nutrition,https://sa.bodybuilding.com/store/opt/men.html?skuId=OPT2500476,,1644,9.2,36.98,0.46,Men's Health Products,Active Ingredients and Essential Daily Nutrients in One Convenient Tablet*,Opti-Men,,,
,Animal,https://sa.bodybuilding.com/store/univ/flex.html?skuId=UNIV164,,464,9.4,27.99,0.64,Glucosamine,The Complete Joint Support Vitamin Stack*,Animal Flex,,,
9.1,Cellucor,https://sa.bodybuilding.com/store/cellucor/c4-ripped.html?skuId=CELLU3660233,9,299,9,39.99,1.33,Beta-Alanine,Explosive Energy and Cutting Formula*,C4 Ripped,Fruity Rainbow Blast,172,9
,Animal,https://sa.bodybuilding.com/store/univ/cutsfree.html?skuId=UNIV109,,853,8.4,34.95,0.83,Caffeine,The Complete Vitamin Stack For Cutting Fat*,Animal Cuts,,155,8
8.8,Kaged Muscle,https://sa.bodybuilding.com/store/kaged-muscle/re-kaged.html?skuId=KAG4610510,2,374,9.3,37.97,1.9,Build Muscle Products,Whey Protein Isolate Powder to Support Muscle Growth*,Re-Kaged,Orange Kream,247,9
,MuscleTech,https://sa.bodybuilding.com/store/muscletech/amino-build-next-gen.html?skuId=MT4060011,,1328,9.6,17.49,0.58,BCAAs,Clinically Dosed Performance Enhancing BCAA Formula With Betaine,Amino Build Next Gen,,,
8.8,Cellucor,https://sa.bodybuilding.com/store/cellucor/c4.html?skuId=CELLU5100018,23,4290,8.7,49.99,0.83,Beta-Alanine,An Advanced Pre-Workout Formulated for Anyone Seeking Increased Energy and Focus*,C4 Original,Juicy Candy Burst,1491,8
,Optimum Nutrition,https://sa.bodybuilding.com/store/opt/women.html?skuId=OPT127,,339,9.5,16.28,0.27,Multivitamins,Daily Multi-Vitamin Capsule for Women's Health*,Opti-Women,,,
9.8,EVLUTION NUTRITION,https://sa.bodybuilding.com/store/evlution-nutrition/glutamine5000.html?skuId=EVL4860171,1,98,9.6,15.99,0.27,Glutamine,5000Mg Of L-Glutamine To Support Optimal Levels During And Post Workout*,Glutamine5000,Unflavored,72,9
8.9,Kaged Muscle,https://sa.bodybuilding.com/store/kaged-muscle/c-hcl-creatine-hcl.html?skuId=KAG4340104,2,135,9.5,19.99,0.27,Creatine HCl,750mg Of Patented Creatine Hydrochloride With Uncompromised Quality and Purity,C-HCl,Lemon Lime,92,9
7.8,Isopure,https://sa.bodybuilding.com/store/isopure/zero-carb.html?skuId=NB035,13,621,8.6,42.49,1.93,Whey Protein Isolate,Zero Carb Isopure!,Zero/Low Carb Isopure,Chocolate holandês com baixo teor de carboidratos,245,8
9.3,RSP Nutrition,https://sa.bodybuilding.com/store/rsp-nutrition/aminolean.html?skuId=RSP4740003,9,2633,9.6,36.97,0.53,Amino Acids,Essential Amino Acids Formulated with Caffeine from Natural Sources to Support Building Lean Muscle*,AminoLean Energy Formula,Blue Raspberry,1367,9
7.9,BSN,https://sa.bodybuilding.com/store/bsn/xplode.html?skuId=BSN2480010,14,4405,8,29.99,1,Improve Workout Products,The Original Pre-Workout Igniter. Re-Engineered,N.O.-Xplode,Fruit Punch,873,7
,Bodybuilding.com Signature,https://sa.bodybuilding.com/store/bodybuilding-com/signature-testosterone-booster.html?skuId=BBCOM5100083,,15,9.2,19.99,0.5,,Natural Testosterone Support*,Signature Testosterone Booster,,13,9
,Dymatize,https://sa.bodybuilding.com/store/dymatize/iso-100.html?skuId=DYM1930120,,2332,9.4,29.99,1.25,Build Muscle Products,Hydrolyzed 100% Whey Protein Isolate,ISO100,,,
,EVLUTION NUTRITION,https://sa.bodybuilding.com/store/evlution-nutrition/l-arginine-1500.html?skuId=EVL5540097,,27,9.9,11.99,0.24,,Contains 1500mg of L-Arginine HCl to support muscle blood flow & protein synthesis*,L-Arginine 1500,,17,9
,MuscleTech,https://sa.bodybuilding.com/store/muscletech/pro-series-alpha-test.html?skuId=MT4140033,,395,8.6,13.92,0.23,Fenugreek,Max-Strength Test Booster Engineered For Enhanced Performance*,Pro Series Alpha Test,,,
,Animal,https://sa.bodybuilding.com/store/univ/stak2.html?skuId=UNIV1790068,,462,8.6,35.49,1.69,Tribulus,The Complete Anabolic Support Vitamin Stack*,Animal Stak,,129,8
9.8,EVLUTION NUTRITION,https://sa.bodybuilding.com/store/evlution-nutrition/glutamine5000.html?skuId=EVL5630021,1,98,9.6,8.99,0.3,Glutamine,5000Mg Of L-Glutamine To Support Optimal Levels During And Post Workout*,Glutamine5000,Unflavored,72,9
8.7,Grenade,https://sa.bodybuilding.com/store/grenade/carb-killa.html?skuId=GREN4580009,13,130,9.2,33.14,2.76,Protein,Triple-Layered Deliciously Crunchy Low-Carb Protein Bar!,Carb Killa,Chocolate Crunch,88,9
9.5,RSP Nutrition,https://sa.bodybuilding.com/store/rsp-nutrition/pump-boost.html?skuId=RSP5370026,4,384,9.3,19.97,0.67,,Promotes Elevated Muscle Pumps and Training Endurance*,Pump Boost,Peach Mango,233,9
,EVLUTION NUTRITION,https://sa.bodybuilding.com/store/evlution-nutrition/vitamode.html?skuId=EVL4230011,,719,9.5,28.99,0.48,Multivitamins,High Performance Multi-Vitamin for Overall Health*,VitaMode,,458,9
9.2,EVLUTION NUTRITION,https://sa.bodybuilding.com/store/evlution-nutrition/leanbcaa.html?skuId=EVL3930002,3,253,9.3,19.99,0.67,BCAAs,BCAA Powder,LeanBCAA,Watermelon,141,9
9.4,EVLUTION NUTRITION,https://sa.bodybuilding.com/store/evlution-nutrition/100-percent-isolate.html?skuId=EVL5580066,5,118,9.4,7.99,1.6,,Great tasting Ultra-Pure Whey Protein Isolate to Support Muscle Growth and Recovery*,100% Isolate,Double Rich Chocolate,74,9
,Bodybuilding.com Signature,https://sa.bodybuilding.com/store/bodybuilding-com/signature-zma.html?skuId=BBCOM5100080,,23,8.2,12.99,0.43,ZMA,Supports Muscle Recovery*,Signature ZMA,,20,8
,Optimum Nutrition,https://sa.bodybuilding.com/store/opt/men.html?skuId=OPT2380276,,1644,9.2,23.98,0.48,Men's Health Products,Active Ingredients and Essential Daily Nutrients in One Convenient Tablet*,Opti-Men,,,
8.9,Kaged Muscle,https://sa.bodybuilding.com/store/kaged-muscle/micropure-whey-protein-isolate.html?skuId=KAG5300011,4,175,9.6,47.99,1.14,,"Gluten-free, No Artificial Colors, Naturally Flavored, and Third-Party Tested",MicroPure Whey Protein Isolate,Chocolate,61,9
,Optimum Nutrition,https://sa.bodybuilding.com/store/opt/women.html?skuId=OPT128,,339,9.5,9.43,0.31,Multivitamins,Daily Multi-Vitamin Capsule for Women's Health*,Opti-Women,,,
9.8,RSP Nutrition,https://sa.bodybuilding.com/store/rsp-nutrition/creatine-monohydrate.html?skuId=RSP4860240,1,809,9.7,9.97,0.17,Creatine Monohydrate,5G Of Pharmaceutical Grade Micronized Creatine To Support Growth*,Creatine Monohydrate,Unflavored,537,9
9.4,EVLUTION NUTRITION,https://sa.bodybuilding.com/store/evlution-nutrition/100-percent-isolate.html?skuId=EVL5460020,5,118,9.4,29.99,1.07,,Great tasting Ultra-Pure Whey Protein Isolate to Support Muscle Growth and Recovery*,100% Isolate,Double Rich Chocolate,74,9
,AllMax Nutrition,https://sa.bodybuilding.com/store/all/caf.html?skuId=ALL022,,82,9.1,4.4,0.04,Caffeine,Caffeine Tablet for Increased Energy*,Caffeine,,,
9.3,EVLUTION NUTRITION,https://sa.bodybuilding.com/store/evlution-nutrition/trans4orm.html?skuId=EVL4040243,2,1857,9.1,6.99,0.7,Weight Loss Products,"Complete Multistage Thermogenic for Fat Loss, with Natural Energy Sources and Focus.*",TRANS4ORM,Blue Raz,845,9
,RSP Nutrition,https://sa.bodybuilding.com/store/rsp-nutrition/prime-t.html?skuId=RSP5040059,,921,9.3,19.97,1.33,,Scientifically Formulated Testosterone Support*,Prime-T,,468,9
8.6,Animal,https://sa.bodybuilding.com/store/universal-nutrition/animal-whey.html?skuId=UNIV4200013,18,596,9.1,46.95,0.84,Whey Protein Isolate,Formulated with Whey Protein Isolate to Supplement the Extreme Protein Requirements of Hardcore Lifters*,Animal Whey,Chocolate Coconut,434,9
,EVLUTION NUTRITION,https://sa.bodybuilding.com/store/evlution-nutrition/flexmode.html?skuId=EVL5200004,,75,9.8,19.99,0.67,,A Gluten-Free Formula to Support Joint Health and Mobility*,FlexMode,,45,9
8.9,EVLUTION NUTRITION,https://sa.bodybuilding.com/store/evlution-nutrition/bcaa-5000.html?skuId=EVL3080010,10,1636,9.3,15.99,0.53,Amino Acids,"BCAA Powder with 5g BCAAs, Zero Sugar and Zero Calories to Support Recovery and Endurance*",BCAA 5000,White Grape,964,9
8.7,Optimum Nutrition,https://sa.bodybuilding.com/store/opt/crea.html?skuId=OPT540096,2,946,9.1,15.37,0.13,Creatine Monohydrate,99.9% Pure Unflavored Creatine with No Fillers or Additives to Support Strength and Power*,Micronized Creatine Powder,Unflavoured,434,9
9.1,BSN,https://sa.bodybuilding.com/store/bsn/true.html?skuId=BSN042,6,582,9.1,43.7,2.73,Whey Protein,Ultra Premium Muscle Mass Gainer*,True-Mass,Manteiga de amendoim e chocolate,105,9
,Bodybuilding.com Signature,https://sa.bodybuilding.com/store/bodybuilding-com-signature/signature-protein-crunch-bars.html?skuId=BBCOM5440029,,178,9.7,2.49,2.49,,Contains 20g of Whey Protein in Each Bar to Support Workout Recovery & Lean Muscle Growth*,Signature Protein Crunch Bars,,,
8.4,Pro Supps,https://sa.bodybuilding.com/store/pro-supps/mr-hyde-nitrox.html?skuId=PROSUP4860195,11,48,8.7,31.49,1.05,,Pre-Workout Amplifier*,Mr. Hyde NitroX,Red Fish Candy,25,8
,Controlled Labs,https://sa.bodybuilding.com/store/clabs/orangetriad.html?skuId=CLABS030,,479,9.2,31.9,0.71,Multivitamins,"Iron Free Daily Multivitamin Supports Optimal Digestion, The Immune System, and Joint Health*",Orange Triad,,,
8.5,EVLUTION NUTRITION,https://sa.bodybuilding.com/store/evlution-nutrition/evltest.html?skuId=EVL4860178,1,1370,9,19.99,1.43,D-Aspartic Acid,Science Based Natural Testosterone Support Complex*!,EVL TEST,Blue Raz,724,8
7.9,Optimum Nutrition,https://sa.bodybuilding.com/store/opt/cas.html?skuId=OPT375,13,2601,8.8,32.88,1.22,Micellar Casein Protein,Nighttime Use Protein Powder for Building Muscle*,Gold Standard 100% Casein,Chocolate supremo,925,8
,Animal,https://sa.bodybuilding.com/store/univ/animalpak.html?skuId=UNIV4240027,,1765,9.3,28.95,1.32,Health & Wellness Products,Supports Rigorous Training for All Competitive Strength and Power Athletes*,Animal Pak,,,
7.9,BSN,https://sa.bodybuilding.com/store/bsn/xplode.html?skuId=BSN2480006,14,4405,8,46.97,0.78,Improve Workout Products,The Original Pre-Workout Igniter. Re-Engineered,N.O.-Xplode,Fruit Punch,873,7
8.7,Optimum Nutrition,https://sa.bodybuilding.com/store/opt/crea.html?skuId=OPT408,2,946,9.1,8.7,0.15,Creatine Monohydrate,99.9% Pure Unflavored Creatine with No Fillers or Additives to Support Strength and Power*,Micronized Creatine Powder,Unflavoured,434,9
8.8,Optimum Nutrition,https://sa.bodybuilding.com/store/optimum-nutrition/gold-standard-pre-workout.html?skuId=OPT4230274,8,555,8.3,19.99,0.67,Improve Workout Products,A Pre-Workout Worthy of the Gold Standard Name,Gold Standard Pre-Workout,Blueberry Lemonade,309,8
9.6,Beverly International,https://sa.bodybuilding.com/store/beverly-international/ump.html?skuId=BEV029,6,212,9.5,40.4,1.35,Whey Protein Blends,Ultra-Premium Protein Powder,UMP,Biscoitos e creme,102,9
,Kaged Muscle,https://sa.bodybuilding.com/store/kaged-muscle/glutamine-powder.html?skuId=KAG2920049,,165,9.7,15.99,0.16,Glutamine,"100% Pure Glutamine Powder Formulated with Vegetable Fermentation, GRAS Approved",Glutamine Powder,,,
8,Optimum Nutrition,https://sa.bodybuilding.com/store/opt/sm.html?skuId=OPT1900062,7,1118,8.5,27.48,3.44,Whey Protein,Protein Powder Weight Gainer*,Serious Mass,Chocolate Peanut Butter,430,8
,MuscleTech,https://sa.bodybuilding.com/store/muscletech/muscletech-performance-series-nitro-tech-100percent-whey-gold.html?skuId=MT5240117,,1882,9,20.29,0.65,Whey Protein,Each Scoop Serves Up 24G Of Ultra-Premium Micro-Filtered Protein,NITRO-TECH 100% Whey Gold,,,
